retrieval 1,retrieval 2,retrieval 3
"In every period, indeed, of every society, the surplus part both of the rude and manufactured produce, or that for which there is no demand at home, must be sent abroad, in order to be exchanged for something for which there is some demand at home. But whether the capital which carries this surplus produce abroad be a foreign or a domestic one, is of very little importance. If the society has not acquired sufficient capital, both to cultivate all its lands, and to manufacture in the completest manner the whole of its rude produce, there is even a considerable advantage that the rude produce should be exported by a foreign capital, in order that the whole stock of the society may be employed in more useful purposes. The wealth of ancient Egypt, that of China and Indostan, sufficiently demonstrate that a nation may attain a very high degree of opulence, though the greater part of its exportation trade be carried on by foreigners. The progress of our North American and West Indian colonies, would have been much less rapid, had no capital but what belonged to themselves been employed in exporting their surplus produce. </p> <p> According to the natural course of things, therefore, the greater part of the capital of every growing society is, first, directed to agriculture, afterwards to manufactures, and, last of all, to foreign commerce. This order of things is so very natural, that in every society that had any territory, it has always, I believe, been in some degree observed. Some of their lands must have been cultivated before any considerable towns could be established, and some sort of coarse industry of the manufacturing kind must have been carried on in those towns, before they could well think of employing themselves in foreign commerce. </p> <p> But though this natural order of things must have taken place in some degree in every such society, it has, in all the modern states of Europe, been in many respects entirely inverted. The foreign commerce of some of their cities has introduced all their finer manufactures, or such as were fit for distant sale; and manufactures and foreign commerce together have given birth to the principal improvements of agriculture.","It then became necessary to say something about the beneficial effects of foreign trade, and the manner in which those effects were obstructed by the laws as they then stood. To the judges who were to decide the business, it appeared a most satisfactory account of the matter, when they were told that foreign trade brought money into the country, but that the laws in question hindered it from bringing so much as it otherwise would do. Those arguments, therefore, produced the wished-for effect. The prohibition of exporting gold and silver was, in France and England, confined to the coin of those respective countries. The exportation of foreign coin and of bullion was made free. In Holland, and in some other places, this liberty was extended even to the coin of the country. The attention of government was turned away from guarding against the exportation of gold and silver, to watch over the balance of trade, as the only cause which could occasion any augmentation or diminution of those metals. From one fruitless care, it was turned away to another care much more intricate, much more embarrassing, and just equally fruitless. The title of Mun’s book, England’s Treasure in Foreign Trade, became a fundamental maxim in the political economy, not of England only, but of all other commercial countries. The inland or home trade, the most important of all, the trade in which an equal capital affords the greatest revenue, and creates the greatest employment to the people of the country, was considered as subsidiary only to foreign trade. It neither brought money into the country, it was said, nor carried any out of it. The country, therefore, could never become either richer or poorer by means of it, except so far as its prosperity or decay might indirectly influence the state of foreign trade. </p> <p> A country that has no mines of its own, must undoubtedly draw its gold and silver from foreign countries, in the same manner as one that has no vineyards of its own must draw its wines. It does not seem necessary, however, that the attention of government should be more turned towards the one than towards the other object. A country that has wherewithal to buy wine, will always get the wine which it has occasion for; and a country that has wherewithal to buy gold and silver, will never be in want of those metals.","They naturally, perhaps necessarily, follow the mode of the times; and their expense comes to be regulated by the same extravagant vanity which directs that of all the other great proprietors in their dominions. The insignificant pageantry of their court becomes every day more brilliant; and the expense of it not only prevents accumulation, but frequently encroaches upon the funds destined for more necessary expenses. What Dercyllidas said of the court of Persia, may be applied to that of several European princes, that he saw there much splendour, but little strength, and many servants, but few soldiers. </p> <p> The importation of gold and silver is not the principal, much less the sole benefit, which a nation derives from its foreign trade. Between whatever places foreign trade is carried on, they all of them derive two distinct benefits from it. It carries out that surplus part of the produce of their land and labour for which there is no demand among them, and brings back in return for it something else for which there is a demand. It gives a value to their superfluities, by exchanging them for something else, which may satisfy a part of their wants and increase their enjoyments. By means of it, the narrowness of the home market does not hinder the division of labour in any particular branch of art or manufacture from being carried to the highest perfection. By opening a more extensive market for whatever part of the produce of their labour may exceed the home consumption, it encourages them to improve its productive power, and to augment its annual produce to the utmost, and thereby to increase the real revenue and wealth of the society. These great and important services foreign trade is continually occupied in performing to all the different countries between which it is carried on. They all derive great benefit from it, though that in which the merchant resides generally derives the greatest, as he is generally more employed in supplying the wants, and carrying out the superfluities of his own, than of any other particular country. To import the gold and silver which may be wanted into the countries which have no mines, is, no doubt a part of the business of foreign commerce. It is, however, a most insignificant part of it. A country which carried on foreign trade merely upon this account, could scarce have occasion to freight a ship in a century. </p> <p> It is not by the importation of gold and silver that the discovery of America has enriched Europe. By the abundance of the American mines, those metals have become cheaper."
"Among civilized and thriving nations, on the contrary, though a great number of people do not labour at all, many of whom consume the produce of ten times, frequently of a hundred times, more labour than the greater part of those who work; yet the produce of the whole labour of the society is so great, that all are often abundantly supplied; and a workman, even of the lowest and poorest order, if he is frugal and industrious, may enjoy a greater share of the necessaries and conveniencies of life than it is possible for any savage to acquire. </p> <p> The causes of this improvement in the productive powers of labour, and the order according to which its produce is naturally distributed among the different ranks and conditions of men in the society, make the subject of the first book of this Inquiry. </p> <p> Whatever be the actual state of the skill, dexterity, and judgment, with which labour is applied in any nation, the abundance or scantiness of its annual supply must depend, during the continuance of that state, upon the proportion between the number of those who are annually employed in useful labour, and that of those who are not so employed. The number of useful and productive labourers, it will hereafter appear, is everywhere in proportion to the quantity of capital stock which is employed in setting them to work, and to the particular way in which it is so employed. The second book, therefore, treats of the nature of capital stock, of the manner in which it is gradually accumulated, and of the different quantities of labour which it puts into motion, according to the different ways in which it is employed. </p> <p> Nations tolerably well advanced as to skill, dexterity, and judgment, in the application of labour, have followed very different plans in the general conduct or direction of it; and those plans have not all been equally favourable to the greatness of its produce. The policy of some nations has given extraordinary encouragement to the industry of the country; that of others to the industry of towns. Scarce any nation has dealt equally and impartially with every sort of industry. Since the down-fall of the Roman empire, the policy of Europe has been more favourable to arts, manufactures, and commerce, the industry of towns, than to agriculture, the Industry of the country.","In the first chapter, I have endeavoured to shew what are the different parts or branches into which the stock, either of an individual, or of a great society, naturally divides itself. In the second, I have endeavoured to explain the nature and operation of money, considered as a particular branch of the general stock of the society. The stock which is accumulated into a capital, may either be employed by the person to whom it belongs, or it may be lent to some other person. In the third and fourth chapters, I have endeavoured to examine the manner in which it operates in both these situations. The fifth and last chapter treats of the different effects which the different employments of capital immediately produce upon the quantity, both of national industry, and of the annual produce of land and labour. </p> </div><!--end chapter--> <div class=""chapter""> <h2><a id=""chap15""></a>CHAPTER I.<br> OF THE DIVISION OF STOCK.</h2> <p> When the stock which a man possesses is no more than sufficient to maintain him for a few days or a few weeks, he seldom thinks of deriving any revenue from it. He consumes it as sparingly as he can, and endeavours, by his labour, to acquire something which may supply its place before it be consumed altogether. His revenue is, in this case, derived from his labour only. This is the state of the greater part of the labouring poor in all countries. </p> <p> But when he possesses stock sufficient to maintain him for months or years, he naturally endeavours to derive a revenue from the greater part of it, reserving only so much for his immediate consumption as may maintain him till this revenue begins to come in. His whole stock, therefore, is distinguished into two parts. That part which he expects is to afford him this revenue is called his capital. The other is that which supplies his immediate consumption, and which consists either, first, in that portion of his whole stock which was originally reserved for this purpose; or, secondly, in his revenue, from whatever source derived, as it gradually comes in; or, thirdly, in such things as had been purchased by either of these in former years, and which are not yet entirely consumed, such as a stock of clothes, household furniture, and the like.","All useful machines and instruments of trade are originally derived from a circulating capital, which furnishes the materials of which they are made, and the maintenance of the workmen who make them. They require, too, a capital of the same kind to keep them in constant repair. </p> <p> No fixed capital can yield any revenue but by means of a circulating capital. The most useful machines and instruments of trade will produce nothing, without the circulating capital, which affords the materials they are employed upon, and the maintenance of the workmen who employ them. Land, however improved, will yield no revenue without a circulating capital, which maintains the labourers who cultivate and collect its produce. </p> <p> To maintain and augment the stock which may be reserved for immediate consumption, is the sole end and purpose both of the fixed and circulating capitals. It is this stock which feeds, clothes, and lodges the people. Their riches or poverty depend upon the abundant or sparing supplies which those two capitals can afford to the stock reserved for immediate consumption. </p> <p> So great a part of the circulating capital being continually withdrawn from it, in order to be placed in the other two branches of the general stock of the society, it must in its turn require continual supplies without which it would soon cease to exist. These supplies are principally drawn from three sources; the produce of land, of mines, and of fisheries. These afford continual supplies of provisions and materials, of which part is afterwards wrought up into finished work and by which are replaced the provisions, materials, and finished work, continually withdrawn from the circulating capital. From mines, too, is drawn what is necessary for maintaining and augmenting that part of it which consists in money. For though, in the ordinary course of business, this part is not, like the other three, necessarily withdrawn from it, in order to be placed in the other two branches of the general stock of the society, it must, however, like all other things, be wasted and worn out at last, and sometimes, too, be either lost or sent abroad, and must, therefore, require continual, though no doubt much smaller supplies. </p> <p> Land, mines, and fisheries, require all both a fixed and circulating capital to cultivate them; and their produce replaces, with a profit not only those capitals, but all the others in the society."
"When the home manufactures were subject to any duty or excise, either the whole or a part of it was frequently drawn back upon their exportation; and when foreign goods liable to a duty were imported, in order to be exported again, either the whole or a part of this duty was sometimes given back upon such exportation. </p> <p> Bounties were given for the encouragement, either of some beginning manufactures, or of such sorts of industry of other kinds as were supposed to deserve particular favour. </p> <p> By advantageous treaties of commerce, particular privileges were procured in some foreign state for the goods and merchants of the country, beyond what were granted to those of other countries. </p> <p> By the establishment of colonies in distant countries, not only particular privileges, but a monopoly was frequently procured for the goods and merchants of the country which established them. </p> <p> The two sorts of restraints upon importation above mentioned, together with these four encouragements to exportation, constitute the six principal means by which the commercial system proposes to increase the quantity of gold and silver in any country, by turning the balance of trade in its favour. I shall consider each of them in a particular chapter, and, without taking much farther notice of their supposed tendency to bring money into the country, I shall examine chiefly what are likely to be the effects of each of them upon the annual produce of its industry. According as they tend either to increase or diminish the value of this annual produce, they must evidently tend either to increase or diminish the real wealth and revenue of the country. </p> </div><!--end chapter--> <div class=""chapter""> <h2><a id=""chap27""></a>CHAPTER II.<br> OF RESTRAINTS UPON IMPORTATION FROM FOREIGN COUNTRIES OF SUCH GOODS AS CAN BE PRODUCED AT HOME.</h2> <p> By restraining, either by high duties, or by absolute prohibitions, the importation of such goods from foreign countries as can be produced at home, the monopoly of the home market is more or less secured to the domestic industry employed in producing them. Thus the prohibition of importing either live cattle or salt provisions from foreign countries, secures to the graziers of Great Britain the monopoly of the home market for butcher’s meat.","Taxes imposed with a view to prevent, or even to diminish importation, are evidently as destructive of the revenue of the customs as of the freedom of trade. </p> </div><!--end chapter--> <div class=""chapter""> <h2><a id=""chap28""></a>CHAPTER III.<br> OF THE EXTRAORDINARY RESTRAINTS UPON THE IMPORTATION OF GOODS OF ALMOST ALL KINDS, FROM THOSE COUNTRIES WITH WHICH THE BALANCE IS SUPPOSED TO BE DISADVANTAGEOUS.</h2> <h3>Part I—Of the Unreasonableness of those Restraints, even upon the Principles of the Commercial System.</h3> <p> To lay extraordinary restraints upon the importation of goods of almost all kinds, from those particular countries with which the balance of trade is supposed to be disadvantageous, is the second expedient by which the commercial system proposes to increase the quantity of gold and silver. Thus, in Great Britain, Silesia lawns may be imported for home consumption, upon paying certain duties; but French cambrics and lawns are prohibited to be imported, except into the port of London, there to be warehoused for exportation. Higher duties are imposed upon the wines of France than upon those of Portugal, or indeed of any other country. By what is called the impost 1692, a duty of five and-twenty per cent. of the rate or value, was laid upon all French goods; while the goods of other nations were, the greater part of them, subjected to much lighter duties, seldom exceeding five per cent. The wine, brandy, salt, and vinegar of France, were indeed excepted; these commodities being subjected to other heavy duties, either by other laws, or by particular clauses of the same law. In 1696, a second duty of twenty-five per cent. the first not having been thought a sufficient discouragement, was imposed upon all French goods, except brandy; together with a new duty of five-and-twenty pounds upon the ton of French wine, and another of fifteen pounds upon the ton of French vinegar. French goods have never been omitted in any of those general subsidies or duties of five per cent. which have been imposed upon all, or the greater part, of the goods enumerated in the book of rates.","It may perhaps in due time prepare the way for a better. </p> </div><!--end chapter--> <div class=""chapter""> <h2><a id=""chap31""></a>CHAPTER VI.<br> OF TREATIES OF COMMERCE.</h2> <p> When a nation binds itself by treaty, either to permit the entry of certain goods from one foreign country which it prohibits from all others, or to exempt the goods of one country from duties to which it subjects those of all others, the country, or at least the merchants and manufacturers of the country, whose commerce is so favoured, must necessarily derive great advantage from the treaty. Those merchants and manufacturers enjoy a sort of monopoly in the country which is so indulgent to them. That country becomes a market, both more extensive and more advantageous for their goods: more extensive, because the goods of other nations being either excluded or subjected to heavier duties, it takes off a greater quantity of theirs; more advantageous, because the merchants of the favoured country, enjoying a sort of monopoly there, will often sell their goods for a better price than if exposed to the free competition of all other nations. </p> <p> Such treaties, however, though they may be advantageous to the merchants and manufacturers of the favoured, are necessarily disadvantageous to those of the favouring country. A monopoly is thus granted against them to a foreign nation; and they must frequently buy the foreign goods they have occasion for, dearer than if the free competition of other nations was admitted. That part of its own produce with which such a nation purchases foreign goods, must consequently be sold cheaper; because, when two things are exchanged for one another, the cheapness of the one is a necessary consequence, or rather is the same thing, with the dearness of the other. The exchangeable value of its annual produce, therefore, is likely to be diminished by every such treaty. This diminution, however, can scarce amount to any positive loss, but only to a lessening of the gain which it might otherwise make. Though it sells its goods cheaper than it otherwise might do, it will not probably sell them for less than they cost; nor, as in the case of bounties, for a price which will not replace the capital employed in bringing them to market, together with the ordinary profits of stock. The trade could not go on long if it did."
"> <a href=""#chap02""><b>BOOK I. OF THE CAUSES OF IMPROVEMENT IN THE PRODUCTIVE POWERS OF LABOUR, AND OF THE ORDER ACCORDING TO WHICH ITS PRODUCE IS NATURALLY DISTRIBUTED AMONG THE DIFFERENT RANKS OF THE PEOPLE. </b></a></td> </tr> <tr> <td> <a href=""#chap03"">CHAPTER I. OF THE DIVISION OF LABOUR.</a></td> </tr> <tr> <td> <a href=""#chap04"">CHAPTER II. OF THE PRINCIPLE WHICH GIVES OCCASION TO THE DIVISION OF LABOUR.</a></td> </tr> <tr> <td> <a href=""#chap05"">CHAPTER III. THAT THE DIVISION OF LABOUR IS LIMITED BY THE EXTENT OF THE MARKET.</a></td> </tr> <tr> <td> <a href=""#chap06"">CHAPTER IV. OF THE ORIGIN AND USE OF MONEY.</a></td> </tr> <tr> <td> <a href=""#chap07"">CHAPTER V. OF THE REAL AND NOMINAL PRICE OF COMMODITIES, OR OF THEIR PRICE IN LABOUR, AND THEIR PRICE IN MONEY.</a></td> </tr> <tr> <td> <a href=""#chap08"">CHAPTER VI. OF THE COMPONENT PART OF THE PRICE OF COMMODITIES.</a></td> </tr> <tr> <td> <a href=""#chap09"">CHAPTER VII. OF THE NATURAL AND MARKET PRICE OF COMMODITIES.</a></td> </tr> <tr> <td> <a href=""#chap10"">CHAPTER VIII. OF THE WAGES OF LABOUR.</a></td> </tr> <tr> <td> <a href=""#chap11"">CHAPTER IX. OF THE PROFITS OF STOCK.</a></td> </tr> <tr> <td> <a href=""#chap12"">CHAPTER X. OF WAGES AND PROFIT IN THE DIFFERENT EMPLOYMENTS OF LABOUR AND STOCK.</a></td> </tr> <tr> <td> <a href=""#chap13"">CHAPTER XI. OF THE RENT OF LAND.</a><br><br></td> </tr> <tr> <td> <a href=""#chap14""><b>BOOK II.","Such operations, therefore, have always proved favourable to the debtor, and ruinous to the creditor, and have sometimes produced a greater and more universal revolution in the fortunes of private persons, than could have been occasioned by a very great public calamity. </p> <p> It is in this manner that money has become, in all civilized nations, the universal instrument of commerce, by the intervention of which goods of all kinds are bought and sold, or exchanged for one another. </p> <p> What are the rules which men naturally observe, in exchanging them either for money, or for one another, I shall now proceed to examine. These rules determine what may be called the relative or exchangeable value of goods. </p> <p> The word VALUE, it is to be observed, has two different meanings, and sometimes expresses the utility of some particular object, and sometimes the power of purchasing other goods which the possession of that object conveys. The one may be called ‘value in use;’ the other, ‘value in exchange.’ The things which have the greatest value in use have frequently little or no value in exchange; and, on the contrary, those which have the greatest value in exchange have frequently little or no value in use. Nothing is more useful than water; but it will purchase scarce any thing; scarce any thing can be had in exchange for it.","A diamond, on the contrary, has scarce any value in use; but a very great quantity of other goods may frequently be had in exchange for it. </p> <p> In order to investigate the principles which regulate the exchangeable value of commodities, I shall endeavour to shew, </p> <p> First, what is the real measure of this exchangeable value; or wherein consists the real price of all commodities. </p> <p> Secondly, what are the different parts of which this real price is composed or made up. </p> <p> And, lastly, what are the different circumstances which sometimes raise some or all of these different parts of price above, and sometimes sink them below, their natural or ordinary rate; or, what are the causes which sometimes hinder the market price, that is, the actual price of commodities, from coinciding exactly with what may be called their natural price. </p> <p> I shall endeavour to explain, as fully and distinctly as I can, those three subjects in the three following chapters, for which I must very earnestly entreat both the patience and attention of the reader: his patience, in order to examine a detail which may, perhaps, in some places, appear unnecessarily tedious; and his attention, in order to understand what may perhaps, after the fullest explication which I am capable of giving it, appear still in some degree obscure. I am always willing to run some hazard of being tedious, in order to be sure that I am perspicuous; and, after taking the utmost pains that I can to be perspicuous, some obscurity may still appear to remain upon a subject, in its own nature extremely abstracted. </p> </div><!--end chapter--> <div class=""chapter""> <h2><a id=""chap07""></a>CHAPTER V.<br> OF THE REAL AND NOMINAL PRICE OF COMMODITIES, OR OF THEIR PRICE IN LABOUR, AND THEIR PRICE IN MONEY.</h2> <p> Every man is rich or poor according to the degree in which he can afford to enjoy the necessaries, conveniencies, and amusements of human life. But after the division of labour has once thoroughly taken place, it is but a very small part of these with which a man’s own labour can supply him."
