retrieval 1,retrieval 2,retrieval 3
"DOCTYPE html> <html xmlns=""http://www.w3.org/1999/xhtml"" xml:lang=""en"" lang=""en""> <head> <meta charset=""UTF-8""> <title>The Wealth of Nations | Project Gutenberg</title> <link rel=""icon"" href=""images/cover.jpg"" type=""image/x-cover""> <style> body { margin-left: 20%; margin-right: 20%; text-align: justify } h1, h2, h3, h4, h5 {text-align: center; font-style: normal; font-weight: normal; line-height: 1.5; margin-top: .5em; margin-bottom: .5em;} h1 {font-size: 300%; margin-top: 0.6em; margin-bottom: 0.6em; letter-spacing: 0.12em; word-spacing: 0.2em; text-indent: 0em;} h2 {font-size: 175%; margin-top: 2em; margin-bottom: 2em;} h3 {font-size: 150%; margin-top: 2em;} h4 {font-size: 120%;} h5 {font-size: 110%;} hr {width: 80%; margin-top: 2em; margin-bottom: 2em;} div.chapter {page-break-before: always; margin-top: 4em;} p {text-indent: 1em; margin-top: 0.25em; margin-bottom: 0.25em; } p.center {text-align: center; text-indent: 0em; margin-top: 1em; margin-bottom: 1em; } a:link {color:blue; text-decoration:none} a:visited {color:blue; text-decoration:none} a:hover {color:red} .pre {white-space: pre;} </style> </head> <body> <div>*** START OF THE PROJECT GUTENBERG EBOOK 3300 ***</div> <h1>An Inquiry into the Nature and Causes of the Wealth of Nations</h1> <h2>by Adam Smith</h2> <hr> <h3>Contents</h3> <table style=""margin-left: auto; margin-right: auto""> <tr> <td> <a href=""#chap01"">INTRODUCTION AND PLAN OF THE WORK.</a><br><br></td> </tr> <tr> <td","The circumstances which seem to have introduced and established this policy are explained in the third book. </p> <p> Though those different plans were, perhaps, first introduced by the private interests and prejudices of particular orders of men, without any regard to, or foresight of, their consequences upon the general welfare of the society; yet they have given occasion to very different theories of political economy; of which some magnify the importance of that industry which is carried on in towns, others of that which is carried on in the country. Those theories have had a considerable influence, not only upon the opinions of men of learning, but upon the public conduct of princes and sovereign states. I have endeavoured, in the fourth book, to explain as fully and distinctly as I can those different theories, and the principal effects which they have produced in different ages and nations. </p> <p> To explain in what has consisted the revenue of the great body of the people, or what has been the nature of those funds, which, in different ages and nations, have supplied their annual consumption, is the object of these four first books. The fifth and last book treats of the revenue of the sovereign, or commonwealth.","That which arises from the more solid improvements of agriculture is much more durable, and cannot be destroyed but by those more violent convulsions occasioned by the depredations of hostile and barbarous nations continued for a century or two together; such as those that happened for some time before and after the fall of the Roman empire in the western provinces of Europe. </p> </div><!--end chapter--> <div class=""chapter""> <h2><a id=""chap25""></a>BOOK IV.<br> OF SYSTEMS OF POLITICAL ECONOMY.</h2> <p> Political economy, considered as a branch of the science of a statesman or legislator, proposes two distinct objects; first, to provide a plentiful revenue or subsistence for the people, or, more properly, to enable them to provide such a revenue or subsistence for themselves; and, secondly, to supply the state or commonwealth with a revenue sufficient for the public services. It proposes to enrich both the people and the sovereign. </p> <p> The different progress of opulence in different ages and nations, has given occasion to two different systems of political economy, with regard to enriching the people. The one may be called the system of commerce, the other that of agriculture. I shall endeavour to explain both as fully and distinctly as I can, and shall begin with the system of commerce. It is the modern system, and is best understood in our own country and in our own times. </p> </div><!--end chapter--> <div class=""chapter""> <h2><a id=""chap26""></a>CHAPTER I.<br> OF THE PRINCIPLE OF THE COMMERCIAL OR MERCANTILE SYSTEM.</h2> <p> That wealth consists in money, or in gold and silver, is a popular notion which naturally arises from the double function of money, as the instrument of commerce, and as the measure of value. In consequence of its being the instrument of commerce, when we have money we can more readily obtain whatever else we have occasion for, than by means of any other commodity. The great affair, we always find, is to get money. When that is obtained, there is no difficulty in making any subsequent purchase. In consequence of its being the measure of value, we estimate that of all other commodities by the quantity of money which they will exchange for."
"Among civilized and thriving nations, on the contrary, though a great number of people do not labour at all, many of whom consume the produce of ten times, frequently of a hundred times, more labour than the greater part of those who work; yet the produce of the whole labour of the society is so great, that all are often abundantly supplied; and a workman, even of the lowest and poorest order, if he is frugal and industrious, may enjoy a greater share of the necessaries and conveniencies of life than it is possible for any savage to acquire. </p> <p> The causes of this improvement in the productive powers of labour, and the order according to which its produce is naturally distributed among the different ranks and conditions of men in the society, make the subject of the first book of this Inquiry. </p> <p> Whatever be the actual state of the skill, dexterity, and judgment, with which labour is applied in any nation, the abundance or scantiness of its annual supply must depend, during the continuance of that state, upon the proportion between the number of those who are annually employed in useful labour, and that of those who are not so employed. The number of useful and productive labourers, it will hereafter appear, is everywhere in proportion to the quantity of capital stock which is employed in setting them to work, and to the particular way in which it is so employed. The second book, therefore, treats of the nature of capital stock, of the manner in which it is gradually accumulated, and of the different quantities of labour which it puts into motion, according to the different ways in which it is employed. </p> <p> Nations tolerably well advanced as to skill, dexterity, and judgment, in the application of labour, have followed very different plans in the general conduct or direction of it; and those plans have not all been equally favourable to the greatness of its produce. The policy of some nations has given extraordinary encouragement to the industry of the country; that of others to the industry of towns. Scarce any nation has dealt equally and impartially with every sort of industry. Since the down-fall of the Roman empire, the policy of Europe has been more favourable to arts, manufactures, and commerce, the industry of towns, than to agriculture, the Industry of the country.","Whenever he employs any part of it in maintaining unproductive hands of any kind, that part is from that moment withdrawn from his capital, and placed in his stock reserved for immediate consumption. </p> <p> Unproductive labourers, and those who do not labour at all, are all maintained by revenue; either, first, by that part of the annual produce which is originally destined for constituting a revenue to some particular persons, either as the rent of land, or as the profits of stock; or, secondly, by that part which, though originally destined for replacing a capital, and for maintaining productive labourers only, yet when it comes into their hands, whatever part of it is over and above their necessary subsistence, may be employed in maintaining indifferently either productive or unproductive hands. Thus, not only the great landlord or the rich merchant, but even the common workman, if his wages are considerable, may maintain a menial servant; or he may sometimes go to a play or a puppet-show, and so contribute his share towards maintaining one set of unproductive labourers; or he may pay some taxes, and thus help to maintain another set, more honourable and useful, indeed, but equally unproductive. No part of the annual produce, however, which had been originally destined to replace a capital, is ever directed towards maintaining unproductive hands, till after it has put into motion its full complement of productive labour, or all that it could put into motion in the way in which it was employed. The workman must have earned his wages by work done, before he can employ any part of them in this manner. That part, too, is generally but a small one. It is his spare revenue only, of which productive labourers have seldom a great deal. They generally have some, however; and in the payment of taxes, the greatness of their number may compensate, in some measure, the smallness of their contribution. The rent of land and the profits of stock are everywhere, therefore, the principal sources from which unproductive hands derive their subsistence. These are the two sorts of revenue of which the owners have generally most to spare. They might both maintain indifferently, either productive or unproductive hands. They seem, however, to have some predilection for the latter. The expense of a great lord feeds generally more idle than industrious people.","The rich merchant, though with his capital he maintains industrious people only, yet by his expense, that is, by the employment of his revenue, he feeds commonly the very same sort as the great lord. </p> <p> The proportion, therefore, between the productive and unproductive hands, depends very much in every country upon the proportion between that part of the annual produce, which, as soon as it comes either from the ground, or from the hands of the productive labourers, is destined for replacing a capital, and that which is destined for constituting a revenue, either as rent or as profit. This proportion is very different in rich from what it is in poor countries. </p> <p> Thus, at present, in the opulent countries of Europe, a very large, frequently the largest, portion of the produce of the land, is destined for replacing the capital of the rich and independent farmer; the other for paying his profits, and the rent of the landlord. But anciently, during the prevalency of the feudal government, a very small portion of the produce was sufficient to replace the capital employed in cultivation. It consisted commonly in a few wretched cattle, maintained altogether by the spontaneous produce of uncultivated land, and which might, therefore, be considered as a part of that spontaneous produce. It generally, too, belonged to the landlord, and was by him advanced to the occupiers of the land. All the rest of the produce properly belonged to him too, either as rent for his land, or as profit upon this paltry capital. The occupiers of land were generally bond-men, whose persons and effects were equally his property. Those who were not bond-men were tenants at will; and though the rent which they paid was often nominally little more than a quit-rent, it really amounted to the whole produce of the land. Their lord could at all times command their labour in peace and their service in war. Though they lived at a distance from his house, they were equally dependent upon him as his retainers who lived in it. But the whole produce of the land undoubtedly belongs to him, who can dispose of the labour and service of all those whom it maintains. In the present state of Europe, the share of the landlord seldom exceeds a third, sometimes not a fourth part of the whole produce of the land."
"If there are any merchants among them, they are, properly, only the agents of wealthier merchants who reside in some of the great commercial cities. </p> <p> When the capital of any country is not sufficient for all those three purposes, in proportion as a greater share of it is employed in agriculture, the greater will be the quantity of productive labour which it puts into motion within the country; as will likewise be the value which its employment adds to the annual produce of the land and labour of the society. After agriculture, the capital employed in manufactures puts into motion the greatest quantity of productive labour, and adds the greatest value to the annual produce. That which is employed in the trade of exportation has the least effect of any of the three. </p> <p> The country, indeed, which has not capital sufficient for all those three purposes, has not arrived at that degree of opulence for which it seems naturally destined. To attempt, however, prematurely, and with an insufficient capital, to do all the three, is certainly not the shortest way for a society, no more than it would be for an individual, to acquire a sufficient one. The capital of all the individuals of a nation has its limits, in the same manner as that of a single individual, and is capable of executing only certain purposes. The capital of all the individuals of a nation is increased in the same manner as that of a single individual, by their continually accumulating and adding to it whatever they save out of their revenue. It is likely to increase the fastest, therefore, when it is employed in the way that affords the greatest revenue to all the inhabitants or the country, as they will thus be enabled to make the greatest savings. But the revenue of all the inhabitants of the country is necessarily in proportion to the value of the annual produce of their land and labour. </p> <p> It has been the principal cause of the rapid progress of our American colonies towards wealth and greatness, that almost their whole capitals have hitherto been employed in agriculture. They have no manufactures, those household and coarser manufactures excepted, which necessarily accompany the progress of agriculture, and which are the work of the women and children in every private family. The greater part, both of the exportation and coasting trade of America, is carried on by the capitals of merchants who reside in Great Britain.","As in a well ordered state of things, therefore, those ground expenses, over and above reproducing in the completest manner their own value, occasion likewise, after a certain time, a reproduction of a neat produce, they are in this system considered as productive expenses. </p> <p> The ground expenses of the landlord, however, together with the original and the annual expenses of the farmer, are the only three sorts of expenses which in this system are considered as productive. All other expenses, and all other orders of people, even those who, in the common apprehensions of men, are regarded as the most productive, are, in this account of things, represented as altogether barren and unproductive. </p> <p> Artificers and manufacturers, in particular, whose industry, in the common apprehensions of men, increases so much the value of the rude produce of land, are in this system represented as a class of people altogether barren and unproductive. Their labour, it is said, replaces only the stock which employs them, together with its ordinary profits. That stock consists in the materials, tools, and wages, advanced to them by their employer; and is the fund destined for their employment and maintenance. Its profits are the fund destined for the maintenance of their employer. Their employer, as he advances to them the stock of materials, tools, and wages, necessary for their employment, so he advances to himself what is necessary for his own maintenance; and this maintenance he generally proportions to the profit which he expects to make by the price of their work. Unless its price repays to him the maintenance which he advances to himself, as well as the materials, tools, and wages, which he advances to his workmen, it evidently does not repay to him the whole expense which he lays out upon it. The profits of manufacturing stock, therefore, are not, like the rent of land, a neat produce which remains after completely repaying the whole expense which must be laid out in order to obtain them. The stock of the farmer yields him a profit, as well as that of the master manufacturer; and it yields a rent likewise to another person, which that of the master manufacturer does not. The expense, therefore, laid out in employing and maintaining artificers and manufacturers, does no more than continue, if one may say so, the existence of its own value, and does not produce any new value. It is, therefore, altogether a barren and unproductive expense.","We should not call a marriage barren or unproductive, though it produced only a son and a daughter, to replace the father and mother, and though it did not increase the number of the human species, but only continued it as it was before. Farmers and country labourers, indeed, over and above the stock which maintains and employs them, reproduce annually a neat produce, a free rent to the landlord. As a marriage which affords three children is certainly more productive than one which affords only two, so the labour of farmers and country labourers is certainly more productive than that of merchants, artificers, and manufacturers. The superior produce of the one class, however, does not, render the other barren or unproductive. </p> <p> Secondly, it seems, on this account, altogether improper to consider artificers, manufacturers, and merchants, in the same light as menial servants. The labour of menial servants does not continue the existence of the fund which maintains and employs them. Their maintenance and employment is altogether at the expense of their masters, and the work which they perform is not of a nature to repay that expense. That work consists in services which perish generally in the very instant of their performance, and does not fix or realize itself in any vendible commodity, which can replace the value of their wages and maintenance. The labour, on the contrary, of artificers, manufacturers, and merchants, naturally does fix and realize itself in some such vendible commodity. It is upon this account that, in the chapter in which I treat of productive and unproductive labour, I have classed artificers, manufacturers, and merchants among the productive labourers, and menial servants among the barren or unproductive. </p> <p> Thirdly, it seems, upon every supposition, improper to say, that the labour of artificers, manufacturers, and merchants, does not increase the real revenue of the society. Though we should suppose, for example, as it seems to be supposed in this system, that the value of the daily, monthly, and yearly consumption of this class was exactly equal to that of its daily, monthly, and yearly production; yet it would not from thence follow, that its labour added nothing to the real revenue, to the real value of the annual produce of the land and labour of the society."
